{
  "basic": {
    "title": "[97M].[libx265].MIKU.EXPO.2024.M@GICAL☆CURE!LOVE♥SHOT!.1080p.60fps.TopazAI.[libfdk_aac]_Lake1059",
    "description": "",
    "tags": ["H.265/HEVC", "1080p"]
  },
  "meta": {
    "author": "Lake1059"
  },
  "source": {
    "url": "https://www.youtube.com/watch?v=kp10JO1Tfrg"
  },
  "download": {
    "url": "https://lake1059.lanzoub.com/ieLjk3fe72bi"
  }
}
