{
  "basic": {
    "title": "[395M] [libx265] MIKU EXPO 2024 M@GICAL☆CURE! LOVE ♥ SHOT! 官方镜头 2160p 60fps 10bit TopazAI [libopus]",
    "description": "原片是30帧的，但油管版本的质量非常好，所以非常适合补帧，效果可~带劲拉",
    "tags": ["2160p", "highfps", "highfps", "265", "ai"]
  },
  "meta": {"author": "Lake1059"},
  "source": {"url": "https://www.youtube.com/watch?v=b6VhAvtekeU"},
  "download": {"url": "https://pan.baidu.com/s/1OeYXgPo0BZBk1n2yfsOyYA?pwd=1059"}
}
